{"format":"taptile-director-project","schemaVersion":"2.0.0","id":"taptile-project-46062c4d","name":"TapTile · 手工堆叠草稿","revision":3,"createdAt":"2026-09-02T12:50:55.872Z","updatedAt":"2026-09-02T12:50:57.909Z","ruleProfileId":"taptile-tray-match3-v1","stage":{"authoringWidth":432,"authoringHeight":768,"exportWidth":1080,"exportHeight":1920,"scale":2.5,"fps":30,"safeAreas":{"board":{"left":50,"top":330,"right":1030,"bottom":1590,"width":980,"height":1260},"tray":{"left":75,"top":1640,"right":1005,"bottom":1830,"width":930,"height":190}}},"assets":{"entries":{}},"visuals":{"archetypes":{"archetype-bear":{"id":"archetype-bear","displayName":"小熊","matchKey":"bear"},"archetype-gift":{"id":"archetype-gift","displayName":"礼盒","matchKey":"gift"},"archetype-shoe":{"id":"archetype-shoe","displayName":"球鞋","matchKey":"shoe"},"archetype-clock":{"id":"archetype-clock","displayName":"闹钟","matchKey":"clock"},"archetype-plant":{"id":"archetype-plant","displayName":"盆栽","matchKey":"plant"},"archetype-book":{"id":"archetype-book","displayName":"红书","matchKey":"book"},"archetype-bird":{"id":"archetype-bird","displayName":"鹦鹉","matchKey":"bird"},"archetype-camera":{"id":"archetype-camera","displayName":"相机","matchKey":"camera"},"archetype-hammer":{"id":"archetype-hammer","displayName":"锤子","matchKey":"hammer"},"archetype-wrench":{"id":"archetype-wrench","displayName":"扳手","matchKey":"wrench"},"archetype-glove":{"id":"archetype-glove","displayName":"手套","matchKey":"glove"},"archetype-flower":{"id":"archetype-flower","displayName":"花朵","matchKey":"flower"},"archetype-donut":{"id":"archetype-donut","displayName":"甜甜圈","matchKey":"donut"},"archetype-mushroom":{"id":"archetype-mushroom","displayName":"蘑菇","matchKey":"mushroom"},"archetype-star":{"id":"archetype-star","displayName":"星星","matchKey":"star"},"archetype-sponge":{"id":"archetype-sponge","displayName":"海绵","matchKey":"sponge"}},"faceAssemblies":{"face-animals-bear":{"id":"face-animals-bear","name":"小熊 · 动物","mode":"overlay-on-body","bodyInteraction":"show-body","parts":[{"id":"face-animals-bear-glyph","source":{"kind":"glyph","value":"🐼"},"transform":{"x":0.5,"y":0.5,"scaleX":0.72,"scaleY":0.72,"rotationDeg":0,"opacity":1}}]},"face-food-bear":{"id":"face-food-bear","name":"小熊 · 食物","mode":"overlay-on-body","bodyInteraction":"show-body","parts":[{"id":"face-food-bear-glyph","source":{"kind":"glyph","value":"🍓"},"transform":{"x":0.5,"y":0.5,"scaleX":0.72,"scaleY":0.72,"rotationDeg":0,"opacity":1}}]},"face-animals-gift":{"id":"face-animals-gift","name":"礼盒 · 动物","mode":"overlay-on-body","bodyInteraction":"show-body","parts":[{"id":"face-animals-gift-glyph","source":{"kind":"glyph","value":"🦊"},"transform":{"x":0.5,"y":0.5,"scaleX":0.72,"scaleY":0.72,"rotationDeg":0,"opacity":1}}]},"face-food-gift":{"id":"face-food-gift","name":"礼盒 · 食物","mode":"overlay-on-body","bodyInteraction":"show-body","parts":[{"id":"face-food-gift-glyph","source":{"kind":"glyph","value":"🍉"},"transform":{"x":0.5,"y":0.5,"scaleX":0.72,"scaleY":0.72,"rotationDeg":0,"opacity":1}}]},"face-animals-shoe":{"id":"face-animals-shoe","name":"球鞋 · 动物","mode":"overlay-on-body","bodyInteraction":"show-body","parts":[{"id":"face-animals-shoe-glyph","source":{"kind":"glyph","value":"🐸"},"transform":{"x":0.5,"y":0.5,"scaleX":0.72,"scaleY":0.72,"rotationDeg":0,"opacity":1}}]},"face-food-shoe":{"id":"face-food-shoe","name":"球鞋 · 食物","mode":"overlay-on-body","bodyInteraction":"show-body","parts":[{"id":"face-food-shoe-glyph","source":{"kind":"glyph","value":"🍋"},"transform":{"x":0.5,"y":0.5,"scaleX":0.72,"scaleY":0.72,"rotationDeg":0,"opacity":1}}]},"face-animals-clock":{"id":"face-animals-clock","name":"闹钟 · 动物","mode":"overlay-on-body","bodyInteraction":"show-body","parts":[{"id":"face-animals-clock-glyph","source":{"kind":"glyph","value":"🐯"},"transform":{"x":0.5,"y":0.5,"scaleX":0.72,"scaleY":0.72,"rotationDeg":0,"opacity":1}}]},"face-food-clock":{"id":"face-food-clock","name":"闹钟 · 食物","mode":"overlay-on-body","bodyInteraction":"show-body","parts":[{"id":"face-food-clock-glyph","source":{"kind":"glyph","value":"🥝"},"transform":{"x":0.5,"y":0.5,"scaleX":0.72,"scaleY":0.72,"rotationDeg":0,"opacity":1}}]},"face-animals-plant":{"id":"face-animals-plant","name":"盆栽 · 动物","mode":"overlay-on-body","bodyInteraction":"show-body","parts":[{"id":"face-animals-plant-glyph","source":{"kind":"glyph","value":"🐰"},"transform":{"x":0.5,"y":0.5,"scaleX":0.72,"scaleY":0.72,"rotationDeg":0,"opacity":1}}]},"face-food-plant":{"id":"face-food-plant","name":"盆栽 · 食物","mode":"overlay-on-body","bodyInteraction":"show-body","parts":[{"id":"face-food-plant-glyph","source":{"kind":"glyph","value":"🍒"},"transform":{"x":0.5,"y":0.5,"scaleX":0.72,"scaleY":0.72,"rotationDeg":0,"opacity":1}}]},"face-animals-book":{"id":"face-animals-book","name":"红书 · 动物","mode":"overlay-on-body","bodyInteraction":"show-body","parts":[{"id":"face-animals-book-glyph","source":{"kind":"glyph","value":"🐨"},"transform":{"x":0.5,"y":0.5,"scaleX":0.72,"scaleY":0.72,"rotationDeg":0,"opacity":1}}]},"face-food-book":{"id":"face-food-book","name":"红书 · 食物","mode":"overlay-on-body","bodyInteraction":"show-body","parts":[{"id":"face-food-book-glyph","source":{"kind":"glyph","value":"🍇"},"transform":{"x":0.5,"y":0.5,"scaleX":0.72,"scaleY":0.72,"rotationDeg":0,"opacity":1}}]},"face-animals-bird":{"id":"face-animals-bird","name":"鹦鹉 · 动物","mode":"overlay-on-body","bodyInteraction":"show-body","parts":[{"id":"face-animals-bird-glyph","source":{"kind":"glyph","value":"🐵"},"transform":{"x":0.5,"y":0.5,"scaleX":0.72,"scaleY":0.72,"rotationDeg":0,"opacity":1}}]},"face-food-bird":{"id":"face-food-bird","name":"鹦鹉 · 食物","mode":"overlay-on-body","bodyInteraction":"show-body","parts":[{"id":"face-food-bird-glyph","source":{"kind":"glyph","value":"🥕"},"transform":{"x":0.5,"y":0.5,"scaleX":0.72,"scaleY":0.72,"rotationDeg":0,"opacity":1}}]},"face-animals-camera":{"id":"face-animals-camera","name":"相机 · 动物","mode":"overlay-on-body","bodyInteraction":"show-body","parts":[{"id":"face-animals-camera-glyph","source":{"kind":"glyph","value":"🦁"},"transform":{"x":0.5,"y":0.5,"scaleX":0.72,"scaleY":0.72,"rotationDeg":0,"opacity":1}}]},"face-food-camera":{"id":"face-food-camera","name":"相机 · 食物","mode":"overlay-on-body","bodyInteraction":"show-body","parts":[{"id":"face-food-camera-glyph","source":{"kind":"glyph","value":"🍩"},"transform":{"x":0.5,"y":0.5,"scaleX":0.72,"scaleY":0.72,"rotationDeg":0,"opacity":1}}]},"face-animals-hammer":{"id":"face-animals-hammer","name":"锤子 · 动物","mode":"overlay-on-body","bodyInteraction":"show-body","parts":[{"id":"face-animals-hammer-glyph","source":{"kind":"glyph","value":"🐙"},"transform":{"x":0.5,"y":0.5,"scaleX":0.72,"scaleY":0.72,"rotationDeg":0,"opacity":1}}]},"face-food-hammer":{"id":"face-food-hammer","name":"锤子 · 食物","mode":"overlay-on-body","bodyInteraction":"show-body","parts":[{"id":"face-food-hammer-glyph","source":{"kind":"glyph","value":"🍪"},"transform":{"x":0.5,"y":0.5,"scaleX":0.72,"scaleY":0.72,"rotationDeg":0,"opacity":1}}]},"face-animals-wrench":{"id":"face-animals-wrench","name":"扳手 · 动物","mode":"overlay-on-body","bodyInteraction":"show-body","parts":[{"id":"face-animals-wrench-glyph","source":{"kind":"glyph","value":"🐳"},"transform":{"x":0.5,"y":0.5,"scaleX":0.72,"scaleY":0.72,"rotationDeg":0,"opacity":1}}]},"face-food-wrench":{"id":"face-food-wrench","name":"扳手 · 食物","mode":"overlay-on-body","bodyInteraction":"show-body","parts":[{"id":"face-food-wrench-glyph","source":{"kind":"glyph","value":"🧁"},"transform":{"x":0.5,"y":0.5,"scaleX":0.72,"scaleY":0.72,"rotationDeg":0,"opacity":1}}]},"face-animals-glove":{"id":"face-animals-glove","name":"手套 · 动物","mode":"overlay-on-body","bodyInteraction":"show-body","parts":[{"id":"face-animals-glove-glyph","source":{"kind":"glyph","value":"🦜"},"transform":{"x":0.5,"y":0.5,"scaleX":0.72,"scaleY":0.72,"rotationDeg":0,"opacity":1}}]},"face-food-glove":{"id":"face-food-glove","name":"手套 · 食物","mode":"overlay-on-body","bodyInteraction":"show-body","parts":[{"id":"face-food-glove-glyph","source":{"kind":"glyph","value":"🍄"},"transform":{"x":0.5,"y":0.5,"scaleX":0.72,"scaleY":0.72,"rotationDeg":0,"opacity":1}}]},"face-animals-flower":{"id":"face-animals-flower","name":"花朵 · 动物","mode":"overlay-on-body","bodyInteraction":"show-body","parts":[{"id":"face-animals-flower-glyph","source":{"kind":"glyph","value":"🦋"},"transform":{"x":0.5,"y":0.5,"scaleX":0.72,"scaleY":0.72,"rotationDeg":0,"opacity":1}}]},"face-food-flower":{"id":"face-food-flower","name":"花朵 · 食物","mode":"overlay-on-body","bodyInteraction":"show-body","parts":[{"id":"face-food-flower-glyph","source":{"kind":"glyph","value":"🥑"},"transform":{"x":0.5,"y":0.5,"scaleX":0.72,"scaleY":0.72,"rotationDeg":0,"opacity":1}}]},"face-animals-donut":{"id":"face-animals-donut","name":"甜甜圈 · 动物","mode":"overlay-on-body","bodyInteraction":"show-body","parts":[{"id":"face-animals-donut-glyph","source":{"kind":"glyph","value":"🐼"},"transform":{"x":0.5,"y":0.5,"scaleX":0.72,"scaleY":0.72,"rotationDeg":0,"opacity":1}}]},"face-food-donut":{"id":"face-food-donut","name":"甜甜圈 · 食物","mode":"overlay-on-body","bodyInteraction":"show-body","parts":[{"id":"face-food-donut-glyph","source":{"kind":"glyph","value":"🍓"},"transform":{"x":0.5,"y":0.5,"scaleX":0.72,"scaleY":0.72,"rotationDeg":0,"opacity":1}}]},"face-animals-mushroom":{"id":"face-animals-mushroom","name":"蘑菇 · 动物","mode":"overlay-on-body","bodyInteraction":"show-body","parts":[{"id":"face-animals-mushroom-glyph","source":{"kind":"glyph","value":"🦊"},"transform":{"x":0.5,"y":0.5,"scaleX":0.72,"scaleY":0.72,"rotationDeg":0,"opacity":1}}]},"face-food-mushroom":{"id":"face-food-mushroom","name":"蘑菇 · 食物","mode":"overlay-on-body","bodyInteraction":"show-body","parts":[{"id":"face-food-mushroom-glyph","source":{"kind":"glyph","value":"🍉"},"transform":{"x":0.5,"y":0.5,"scaleX":0.72,"scaleY":0.72,"rotationDeg":0,"opacity":1}}]},"face-animals-star":{"id":"face-animals-star","name":"星星 · 动物","mode":"overlay-on-body","bodyInteraction":